{
  "$schema": "https://scrymore.com/schemas/scf/1.0.json",
  "scf": "1.0",
  "source": {
    "kind": "flutter-golden",
    "platform": "android",
    "framework": "flutter",
    "tool": { "name": "scry-capture-flutter", "version": "0.1.0" }
  },
  "repository": { "url": "https://github.com/acme/kettle-flutter", "branch": "main" },
  "createdAt": "2026-10-04T00:00:00Z",
  "defaults": {
    "capture": { "method": "emulator", "device": { "name": "Pixel 8", "os": "Android 15" }, "scale": 3 }
  },
  "counts": { "declared": 3, "captured": 3, "skipped": [] },
  "captures": [
    {
      "id": "Screens/Menu",
      "image": "images/menu.png",
      "kind": "screen",
      "title": ["Screens"],
      "name": "Menu",
      "code": { "file": "lib/screens/menu_screen.dart", "line": 8 },
      "capture": { "viewport": { "width": 390, "height": 844 } }
    },
    {
      "id": "Screens/Item Detail",
      "image": "images/item-detail.png",
      "kind": "screen",
      "title": ["Screens"],
      "name": "Item Detail",
      "code": { "file": "lib/screens/item_detail_screen.dart", "line": 8 },
      "capture": { "viewport": { "width": 390, "height": 844 } }
    },
    {
      "id": "Screens/Order",
      "image": "images/order.png",
      "kind": "screen",
      "title": ["Screens"],
      "name": "Order",
      "code": { "file": "lib/screens/order_screen.dart", "line": 8 },
      "capture": { "viewport": { "width": 390, "height": 844 } }
    }
  ]
}
